{
  "schemaVersion": "1.0.0",
  "sessionId": "0f5a1c3e-6b21-4d7f-9a08-1c2d3e4f5a6b",
  "eventId": 123456,
  "eventType": "engine_output",
  "platform": "ANDROID",
  "appVersion": "1.4.0",
  "appBuild": "2401",
  "engineVersion": "heading-3.2.0",
  "configVersion": "precision-v1-candidate-1",
  "configHash": "sha256:e85a0eb4073a38c43828a294db750c7ee3ca5b7a17165b34650c8c40a99fab6f",
  "deviceAnonymousId": "sha256:b450122d76a97f0844f8b20fc63a5db6c03086c28b163861b71c0fc756e60806",
  "hardwareRuntimeIdentity": "ANDROID:example-runtime-tuple",
  "sensorRuntimeIdentity": "sha256:6e7dadbedc4e1dc16778e4e1a63cd118ce33d61a0e409cd063332d4e00efc8fc",
  "osBuildIdentity": "example-exact-build",
  "wallTimeUtc": "2026-08-29T12:34:56.123456Z",
  "recordMonotonicTimeNs": 1234567890123,
  "sourceMonotonicTimeNs": 1234567889000,
  "arrivalMonotonicTimeNs": 1234567890100,
  "sourceClock": "ELAPSED_REALTIME",
  "clockMappingId": "IDENTITY",
  "sequence": 42,
  "payload": {
    "referenceAxis": "PHYSICAL_TOP_EDGE_HORIZONTAL_PROJECTION",
    "attitudeEarthFrame": "REFERENCE_ENU",
    "canonicalHeadingReference": "TRUE",
    "implementationVariant": "AND-G1-50",
    "providerId": "GOOGLE_FOP",
    "providerErrorSource": "GOOGLE_CONSERVATIVE",
    "providerRuntimeIdentity": "GMS:example-exact-version",
    "locationProviderId": "GOOGLE_FLP",
    "locationProviderRuntimeIdentity": "GMS:example-exact-version",
    "hardwareRuntimeIdentity": "ANDROID:example-runtime-tuple",
    "sensorRuntimeIdentity": "sha256:6e7dadbedc4e1dc16778e4e1a63cd118ce33d61a0e409cd063332d4e00efc8fc",
    "osBuildIdentity": "example-exact-build",
    "engineDecisionLogicHash": "sha256:64a844e67c0a485dd3ce0cbed2f1c27324b2baaa0e11395928ed3ffe047824c6",
    "requestedOrientationPeriodUs": 20000,
    "observedOrientationRateHz": 48.7,
    "providerReferenceContract": "TRUE_IF_DECLINATION_AVAILABLE_ELSE_MAGNETIC",
    "resolvedReference": "TRUE_VERIFIED",
    "referenceResolutionMethod": "FRESH_LOCATION_WMM_MAGNETIC_CROSSCHECK",
    "referenceHypothesisResidualTrueDeg": 0.41,
    "referenceHypothesisResidualMagneticDeg": 7.88,
    "referenceAmbiguityBound95Deg": 0.0,
    "providerHeadingDeg": 189.0,
    "magneticHeadingDeg": 181.12,
    "magneticHeadingSource": "ANDROID_ACCEL_MAG",
    "uncorrectedTrueHeadingDeg": 189.0,
    "deviationCorrectionState": "NONE",
    "deviationCorrectionProfileId": null,
    "deviationCorrectionProfileHash": "NONE",
    "deviationCorrectionDeg": 0.0,
    "trueHeadingDeg": 189.0,
    "declinationDeg": 8.29,
    "geomagneticModelId": "WMM2025",
    "declinationCoefficientSha256": "NOT_VENDORED",
    "declinationErrorModelSha256": "NOT_VENDORED",
    "declinationSigma1Deg": 0.36,
    "declinationEnvelopeDeg": 0.03,
    "horizontalIntensityNanoTesla": 21450.0,
    "altitudeReference": "WGS84_ELLIPSOID",
    "locationAuthorizationAccuracy": "PRECISE_FULL",
    "spaceWeather": {
      "kp": 3.67,
      "observationTimeUtc": "2026-08-29T12:00:00Z",
      "cacheAgeMs": 930000,
      "state": "QUIET"
    },
    "instrumentBound95Deg": 4.0,
    "placementBound95Deg": 3.0,
    "reportedBound95Deg": 7.0,
    "uncertaintyCoverageTarget": 0.95,
    "uncertaintyCoverageEvidenceState": "TARGET_ONLY",
    "boundCalibrationState": "CANDIDATE",
    "trustAction": "SHOW_DEGRADED_RESULT",
    "provisionalQualityGrade": "LOW_CONFIDENCE",
    "displayQualityGrade": null,
    "gradeLimitedBy": "DEVICE_FLOOR",
    "osHeadingErrorDeg": 1.5,
    "conservativeHeadingErrorDeg": 1.8,
    "sampleCircularDispersionDeg": 0.62,
    "circularResultantLength": 0.99987,
    "transformAgreementDeg": 0.11,
    "pipelineAgreementDeg": 0.54,
    "pipelineSet": [
      "GOOGLE_FOP",
      "ANDROID_ROTATION_VECTOR",
      "ANDROID_ACCEL_MAG"
    ],
    "pitchDeg": 0.4,
    "rollDeg": -0.8,
    "fieldMagnitudeMicroTesla": 48.7,
    "expectedFieldMagnitudeMicroTesla": 47.9,
    "relativeMagnitudeResidual": 0.0167,
    "measuredInclinationPositiveDownDeg": 64.2,
    "expectedInclinationPositiveDownDeg": 63.3,
    "inclinationResidualDeg": 0.9,
    "stationaryFieldMadMicroTesla": 0.31,
    "referenceMagneticPrecheckState": "CLEAN_FOR_REFERENCE",
    "magneticState": "CLEAN",
    "chargingState": "NOT_CHARGING",
    "thermalState": "NOMINAL",
    "measurementMode": "FLAT_TOP_EDGE",
    "placementMethod": "FREEHAND",
    "placementProfileId": "flat-freehand-v1",
    "placementProfileHash": "sha256:81a1337acfb20f8c40a31ef2a70233cbaf772314f3e2287eee0db14dabf23c64",
    "measurementState": "DEGRADED",
    "rejectionReasons": [],
    "fengShuiRuleSetVersion": "fengshui-v1",
    "fengShuiRuleSetHash": "sha256:d4f26003d72adb892ce4868abcfb3a5c8403850f29d111a55f2aad9f71270493",
    "fengShuiReferenceSelection": "TRUE",
    "primaryFengShuiSector": "ding",
    "possibleFengShuiSectors": [
      "wu",
      "ding"
    ],
    "boundaryStraddled": true,
    "oldestInputAgeMs": 18.2,
    "locationAgeMs": 820,
    "aggregationDurationMs": 3200,
    "effectiveHeadingSampleCount": 146,
    "periodicSupportSampleCount": 146
  }
}
